{
  "$schema": "https://json-schema.org/draft/2020-12/schema",
  "$id": "https://clipmill.dev/schemas/clipmill.edit_ir.v1.json",
  "title": "EditIr",
  "description": "The edit document (book ch. 17): a versioned, multi-track, non-destructive timeline that the preview, the render compiler, and later the NLE exporter all read. No subsystem may render, preview, or export from any other representation. All time is integer ticks at 1/90000 (D06); a segment's program position is the sum of the durations before it and is never stored, so a trim cannot leave a stale offset behind.",
  "type": "object",
  "required": ["version", "timebase", "video", "captions", "audio"],
  "additionalProperties": false,
  "properties": {
    "version": {
      "const": "ir/1"
    },
    "timebase": {
      "type": "object",
      "required": ["num", "den"],
      "additionalProperties": false,
      "properties": {
        "num": {
          "const": 1
        },
        "den": {
          "const": 90000
        }
      }
    },
    "video": {
      "type": "object",
      "additionalProperties": false,
      "properties": {
        "transition_ticks": {
          "description": "Requested duration of soft cuts: hold the last outgoing composition over incoming video. Zero or absent preserves hard cuts. Effective duration is bounded by the incoming shot; audio, captions and program timing remain unchanged.",
          "type": "integer",
          "minimum": 0,
          "maximum": 22500
        },
        "segments": {
          "type": "array",
          "items": {
            "$ref": "#/$defs/videoSegment"
          }
        }
      }
    },
    "captions": {
      "type": "object",
      "required": ["style_ref"],
      "additionalProperties": false,
      "properties": {
        "style_ref": {
          "description": "Named caption preset; the style itself lives with the presets, not in every document.",
          "type": "string"
        },
        "options": {
          "description": "Saved clip-wide overrides over the named preset. Case changes burned-in captions only; sidecars retain the spoken spelling.",
          "type": "object",
          "additionalProperties": false,
          "properties": {
            "font_size": { "type": "integer", "minimum": 24, "maximum": 160 },
            "spoken": { "type": "string", "pattern": "^#[0-9a-fA-F]{6}$" },
            "unspoken": { "type": "string", "pattern": "^#[0-9a-fA-F]{6}$" },
            "outline": { "type": "string", "pattern": "^#[0-9a-fA-F]{6}$" },
            "text_case": { "enum": ["original", "upper", "lower"] }
          }
        },
        "cues": {
          "type": "array",
          "items": {
            "$ref": "#/$defs/captionCue"
          },
          "description": "What a reader gets. Every sidecar is written from this list and only this list, because a sidecar is what a viewer who cannot hear is left with \u2014 so it carries the conservative grouping, always."
        },
        "burn_in": {
          "description": "What a watcher gets, when the two should differ. The kinetic grouping is burned into the picture; absent, the reading cues are burned in instead. Two lists rather than one because the caption engine produces two groupings of one token array, and this is where they would otherwise collapse back into one \u2014 a burn-in that inherited the reading grouping is merely conservative, while a sidecar that inherited the kinetic one is the divergence that engine exists to prevent. The asymmetry is deliberate.",
          "type": "array",
          "items": {
            "$ref": "#/$defs/captionCue"
          }
        }
      }
    },
    "audio": {
      "type": "object",
      "required": ["target_lufs", "true_peak_dbtp"],
      "additionalProperties": false,
      "properties": {
        "target_lufs": {
          "description": "Loudness target in LUFS. Loudness is a measurement, not a time, so it is legitimately real-valued.",
          "type": "number"
        },
        "true_peak_dbtp": {
          "type": "number"
        },
        "gain_curve": {
          "type": "array",
          "items": {
            "type": "object",
            "required": ["t_ticks", "gain_db"],
            "additionalProperties": false,
            "properties": {
              "t_ticks": {
                "type": "integer",
                "minimum": 0
              },
              "gain_db": {
                "type": "number"
              }
            }
          }
        }
      }
    },
    "assets": {
      "description": "Assets referenced by content hash, each carrying the licence record the render manifest echoes.",
      "type": "array",
      "items": {
        "type": "object",
        "required": ["hash", "license"],
        "additionalProperties": false,
        "properties": {
          "hash": {
            "$ref": "#/$defs/sha256"
          },
          "license": {
            "type": "string"
          }
        }
      }
    },
    "rationale": {
      "description": "Why the director cut here. Never consumed by any render path, so explanation can never perturb pixels.",
      "type": "object",
      "additionalProperties": false,
      "properties": {
        "candidate_id": {
          "type": "string"
        },
        "decisions": {
          "type": "array",
          "items": {
            "type": "string"
          }
        }
      }
    }
  },
  "$defs": {
    "sha256": {
      "type": "string",
      "pattern": "^sha256:[0-9a-f]{64}$"
    },
    "cropRect": {
      "description": "Integer pixel rectangle in the source frame's coordinate space.",
      "type": "object",
      "required": ["x", "y", "width", "height"],
      "additionalProperties": false,
      "properties": {
        "x": {
          "type": "integer",
          "minimum": 0
        },
        "y": {
          "type": "integer",
          "minimum": 0
        },
        "width": {
          "type": "integer",
          "minimum": 1
        },
        "height": {
          "type": "integer",
          "minimum": 1
        }
      }
    },
    "videoSegment": {
      "type": "object",
      "required": ["segment_id", "source_fingerprint", "in_ticks", "out_ticks", "layout"],
      "additionalProperties": false,
      "properties": {
        "segment_id": {
          "type": "string",
          "minLength": 1
        },
        "source_fingerprint": {
          "$ref": "#/$defs/sha256"
        },
        "in_ticks": {
          "type": "integer",
          "minimum": 0
        },
        "out_ticks": {
          "type": "integer",
          "minimum": 1
        },
        "layout": {
          "type": "object",
          "required": ["state"],
          "additionalProperties": false,
          "properties": {
            "state": {
              "enum": ["speaker_fill", "fit", "two_up"]
            },
            "crop_path": {
              "description": "Crop keyframes in segment-local ticks, so trimming the source window cannot silently re-time the camera move.",
              "type": "array",
              "items": {
                "type": "object",
                "required": ["t_ticks", "rect"],
                "additionalProperties": false,
                "properties": {
                  "t_ticks": {
                    "type": "integer",
                    "minimum": 0
                  },
                  "rect": {
                    "$ref": "#/$defs/cropRect"
                  },
                  "easing": {
                    "enum": ["linear", "ease_in", "ease_out", "ease_in_out"]
                  }
                }
              }
            },
            "secondary_crop_path": {
              "description": "Lower viewport crop keyframes for a two_up composition. The primary path fills the upper half; both paths use segment-local ticks.",
              "type": "array",
              "items": {
                "type": "object",
                "required": ["t_ticks", "rect"],
                "additionalProperties": false,
                "properties": {
                  "t_ticks": {
                    "type": "integer",
                    "minimum": 0
                  },
                  "rect": {
                    "$ref": "#/$defs/cropRect"
                  },
                  "easing": {
                    "enum": ["linear", "ease_in", "ease_out", "ease_in_out"]
                  }
                }
              }
            }
          }
        }
      }
    },
    "captionCue": {
      "type": "object",
      "required": ["cue_id", "start_ticks", "end_ticks", "region", "anim", "lines"],
      "additionalProperties": false,
      "properties": {
        "cue_id": {
          "type": "string",
          "minLength": 1
        },
        "start_ticks": {
          "type": "integer",
          "minimum": 0
        },
        "end_ticks": {
          "type": "integer",
          "minimum": 1
        },
        "region": {
          "enum": ["lower_safe", "upper_safe", "center"]
        },
        "anim": {
          "enum": ["none", "karaoke"]
        },
        "lines": {
          "description": "Line breaks are decided once and stored here \u2014 the parity keystone. Preview and render must never re-wrap text independently.",
          "type": "array",
          "minItems": 1,
          "items": {
            "type": "object",
            "required": ["words"],
            "additionalProperties": false,
            "properties": {
              "words": {
                "type": "array",
                "minItems": 1,
                "items": {
                  "type": "object",
                  "required": ["text", "start_ticks", "end_ticks"],
                  "additionalProperties": false,
                  "properties": {
                    "text": {
                      "type": "string",
                      "minLength": 1
                    },
                    "start_ticks": {
                      "type": "integer",
                      "minimum": 0
                    },
                    "end_ticks": {
                      "type": "integer",
                      "minimum": 1
                    },
                    "word_id": {
                      "description": "Which word this is, shared by its occurrence in the reading cues and in the burned-in cues. A correction is addressed to the word, so it lands in both presentations. Absent only in a document that predates word identities; the daemon assigns them on migration.",
                      "type": "string",
                      "minLength": 1
                    }
                  }
                }
              }
            }
          }
        }
      }
    }
  }
}
